{
  "corpusVersion": "fiscal-extractor-corpus.2026-07.v1",
  "fixtureId": "m115-single-landlord-001-native",
  "semanticCaseId": "m115-single-landlord-001",
  "parentFixtureId": null,
  "documentType": "MODEL_115",
  "formVersion": "AEAT_MODEL_115_PRINTED_LAYOUT_VERSIONED",
  "fiscalYear": 2026,
  "period": "1T",
  "documentKind": "DRAFT",
  "filingStatus": "DRAFT",
  "temporalScope": "SPECIFIC_PERIOD",
  "lifecycleLabels": [
    "NOT_CURRENT_CENSUS_STATUS"
  ],
  "stateCoverage": "PERIOD_ONLY",
  "visualVariant": "NATIVE_PDF",
  "expectedEnvelope": {
    "isComplete": false
  },
  "expectedFields": [
    {
      "factType": "WITHHOLDING.RENT",
      "value": {
        "urbanPropertyRent": true,
        "subjectToWithholding": true,
        "declarationModel": "115"
      },
      "normalizedValue": {
        "urbanPropertyRent": true,
        "subjectToWithholding": true,
        "declarationModel": "115"
      },
      "page": 1,
      "sourceLabel": "Arrendamiento o subarrendamiento de inmuebles urbanos"
    }
  ],
  "expectedQuestionMappings": [
    {
      "questionId": "G_RENTS_PREMISES",
      "proposedAnswer": "YES",
      "canSkipQuestion": false,
      "confirmationRequired": true
    },
    {
      "questionId": "G_RENT_WITHHOLDING",
      "proposedAnswer": "YES",
      "canSkipQuestion": false,
      "confirmationRequired": true
    }
  ],
  "mustNotInfer": [
    {
      "code": "CURRENT_CENSUS_STATUS",
      "reason": "Una declaración concreta no acredita por sí sola la situación censal actual."
    },
    {
      "code": "FUTURE_OBLIGATION",
      "reason": "Una declaración de un período no acredita una obligación futura."
    },
    {
      "code": "VERIFIED_FILING",
      "reason": "El impreso sintético no acredita presentación ante la AEAT."
    },
    {
      "code": "OFFICIAL_DOCUMENT_VALIDITY",
      "reason": "El documento sintético carece de validez oficial."
    },
    {
      "code": "CURRENT_RENTAL_STATUS",
      "reason": "Un 115 anterior no acredita que el alquiler continúe actualmente."
    },
    {
      "code": "ABSENCE_OUTSIDE_CAPTURE",
      "reason": "Una captura parcial no permite inferir datos ausentes fuera de ella."
    }
  ],
  "allowAdditionalFactTypes": [],
  "source": {
    "kind": "SYNTHETIC_OFFICIAL_FORM",
    "authorizationRecorded": true,
    "sha256": "7b3a438c17a328cac792d578882cd1dd4d13efb0adfc92a71ff8881f09ed5a30",
    "officialReference": {
      "url": "https://sede.agenciatributaria.gob.es/Sede/procedimientoini/GH02.shtml",
      "capturedOn": "2026-07-15",
      "sha256": null
    },
    "anonymizationAudit": {
      "textLayerChecked": true,
      "acroFormChecked": true,
      "metadataChecked": true,
      "annotationsChecked": true,
      "hiddenPagesChecked": true,
      "qrAndBarcodeChecked": true,
      "embeddedFilesChecked": true,
      "originalFileNameStored": false
    }
  },
  "asset": {
    "pdfPath": "pdf/m115-single-landlord-001-native.pdf",
    "extractedTextPath": "text/m115-single-landlord-001-native.txt"
  },
  "extractor": {
    "contractVersion": "1.0.0",
    "catalogVersion": "fiscal-document-extractors.2026-07.v2",
    "extractorVersion": "aeat.model.115.v2"
  }
}
