{
  "corpusVersion": "fiscal-extractor-corpus.2026-07.v1",
  "fixtureId": "m390-multiple-activities-002-native",
  "semanticCaseId": "m390-multiple-activities-002",
  "parentFixtureId": null,
  "documentType": "MODEL_390",
  "formVersion": "AEAT_MODEL_390_BOE_2026",
  "fiscalYear": 2026,
  "period": "ANNUAL",
  "documentKind": "DRAFT",
  "filingStatus": "DRAFT",
  "temporalScope": "TARGET_FISCAL_YEAR",
  "lifecycleLabels": [
    "NOT_CURRENT_CENSUS_STATUS"
  ],
  "stateCoverage": "PERIOD_ONLY",
  "visualVariant": "NATIVE_PDF",
  "expectedEnvelope": {
    "isComplete": false
  },
  "expectedFields": [
    {
      "factType": "VAT.ANNUAL_SUMMARY",
      "value": {
        "annualVatSummaryObserved": true,
        "filingStatus": "DRAFT"
      },
      "normalizedValue": {
        "annualVatSummaryObserved": true,
        "filingStatus": "DRAFT"
      },
      "page": 1,
      "sourceLabel": "IVA · Resumen anual"
    },
    {
      "factType": "VAT.MODEL_390_FACTORS",
      "value": {
        "annualSummaryObserved": true,
        "explicitRegimes": [],
        "euOperationKeys": []
      },
      "normalizedValue": {
        "annualSummaryObserved": true,
        "explicitRegimes": [],
        "euOperationKeys": []
      },
      "page": 1,
      "sourceLabel": "Factores observados en el resumen anual de IVA"
    }
  ],
  "expectedQuestionMappings": [],
  "mustNotInfer": [
    {
      "code": "CURRENT_CENSUS_STATUS",
      "reason": "Una declaración concreta no acredita por sí sola la situación censal actual."
    },
    {
      "code": "FUTURE_OBLIGATION",
      "reason": "Una declaración de un período no acredita una obligación futura."
    },
    {
      "code": "VERIFIED_FILING",
      "reason": "El impreso sintético no acredita presentación ante la AEAT."
    },
    {
      "code": "OFFICIAL_DOCUMENT_VALIDITY",
      "reason": "El documento sintético carece de validez oficial."
    },
    {
      "code": "ABSENCE_OUTSIDE_CAPTURE",
      "reason": "Una captura parcial no permite inferir datos ausentes fuera de ella."
    }
  ],
  "allowAdditionalFactTypes": [],
  "source": {
    "kind": "SYNTHETIC_OFFICIAL_FORM",
    "authorizationRecorded": true,
    "sha256": "82341566311956a56507bf785ccf4245b063437f46115acbeedd47d8db813b11",
    "officialReference": {
      "url": "https://sede.agenciatributaria.gob.es/Sede/procedimientoini/G412.shtml",
      "capturedOn": "2026-07-15",
      "sha256": null
    },
    "anonymizationAudit": {
      "textLayerChecked": true,
      "acroFormChecked": true,
      "metadataChecked": true,
      "annotationsChecked": true,
      "hiddenPagesChecked": true,
      "qrAndBarcodeChecked": true,
      "embeddedFilesChecked": true,
      "originalFileNameStored": false
    }
  },
  "asset": {
    "pdfPath": "pdf/m390-multiple-activities-002-native.pdf",
    "extractedTextPath": "text/m390-multiple-activities-002-native.txt"
  },
  "extractor": {
    "contractVersion": "1.0.0",
    "catalogVersion": "fiscal-document-extractors.2026-07.v2",
    "extractorVersion": "aeat.model.390.v2"
  }
}
