{
  "corpusVersion": "fiscal-extractor-corpus.2026-07.v1",
  "fixtureId": "m036-complex-deregistration-005-native",
  "semanticCaseId": "m036-complex-deregistration-005",
  "parentFixtureId": null,
  "documentType": "MODEL_036",
  "formVersion": "AEAT_MODEL_036_INTERESTED_COPY_2026",
  "fiscalYear": 2026,
  "period": null,
  "documentKind": "DRAFT",
  "filingStatus": "DRAFT",
  "temporalScope": "SPECIFIC_PERIOD",
  "lifecycleLabels": [
    "NOT_CURRENT_CENSUS_STATUS"
  ],
  "stateCoverage": "PARTIAL_CURRENT_STATE",
  "visualVariant": "NATIVE_PDF",
  "expectedEnvelope": {
    "isComplete": false
  },
  "expectedFields": [
    {
      "factType": "SUBJECT.TAXPAYER_TYPE",
      "value": "NATURAL_PERSON",
      "normalizedValue": "NATURAL_PERSON",
      "page": 1,
      "sourceLabel": "Tipo de contribuyente"
    },
    {
      "factType": "ACTIVITY.LIST",
      "value": [
        {
          "code": "653.2",
          "description": "COMERCIO MENOR ARTICULOS HOGAR"
        },
        {
          "code": "665",
          "description": "VENTA EN LINEA"
        }
      ],
      "normalizedValue": [
        {
          "code": "653.2",
          "description": "COMERCIO MENOR ARTICULOS HOGAR"
        },
        {
          "code": "665",
          "description": "VENTA EN LINEA"
        }
      ],
      "page": 6,
      "sourceLabel": "Actividades económicas"
    },
    {
      "factType": "ACTIVITY.NATURE",
      "value": [
        "BUSINESS"
      ],
      "normalizedValue": [
        "BUSINESS"
      ],
      "page": 6,
      "sourceLabel": "Sección de la actividad"
    },
    {
      "factType": "ACTIVITY.DATES",
      "value": [
        "2023-01-01"
      ],
      "normalizedValue": [
        "2023-01-01"
      ],
      "page": 6,
      "sourceLabel": "Fecha de inicio de la actividad"
    }
  ],
  "expectedQuestionMappings": [
    {
      "questionId": "A_INVOICING_SUBJECT",
      "proposedAnswer": "NATURAL_PERSON",
      "canSkipQuestion": false,
      "confirmationRequired": true
    },
    {
      "questionId": "C_ACTIVITY_KINDS",
      "proposedAnswer": [
        "BUSINESS"
      ],
      "canSkipQuestion": false,
      "confirmationRequired": true
    },
    {
      "questionId": "B_START_DATE",
      "proposedAnswer": "2023-01-01",
      "canSkipQuestion": false,
      "confirmationRequired": true
    }
  ],
  "mustNotInfer": [
    {
      "code": "CURRENT_CENSUS_STATUS",
      "reason": "Una declaración concreta no acredita por sí sola la situación censal actual."
    },
    {
      "code": "FUTURE_OBLIGATION",
      "reason": "Una declaración de un período no acredita una obligación futura."
    },
    {
      "code": "VERIFIED_FILING",
      "reason": "El impreso sintético no acredita presentación ante la AEAT."
    },
    {
      "code": "OFFICIAL_DOCUMENT_VALIDITY",
      "reason": "El documento sintético carece de validez oficial."
    },
    {
      "code": "ABSENCE_OUTSIDE_CAPTURE",
      "reason": "Una captura parcial no permite inferir datos ausentes fuera de ella."
    }
  ],
  "allowAdditionalFactTypes": [
    "CENSUS.EVENT"
  ],
  "source": {
    "kind": "SYNTHETIC_OFFICIAL_FORM",
    "authorizationRecorded": true,
    "sha256": "18ecb86f2a2324c153af866ba940de8b46bb53bfdd7e7e2cb125c65c79201a10",
    "officialReference": {
      "url": "https://sede.agenciatributaria.gob.es/Sede/procedimientoini/G322.shtml",
      "capturedOn": "2026-07-15",
      "sha256": null
    },
    "anonymizationAudit": {
      "textLayerChecked": true,
      "acroFormChecked": true,
      "metadataChecked": true,
      "annotationsChecked": true,
      "hiddenPagesChecked": true,
      "qrAndBarcodeChecked": true,
      "embeddedFilesChecked": true,
      "originalFileNameStored": false
    }
  },
  "asset": {
    "pdfPath": "pdf/m036-complex-deregistration-005-native.pdf",
    "extractedTextPath": "text/m036-complex-deregistration-005-native.txt"
  },
  "extractor": {
    "contractVersion": "1.0.0",
    "catalogVersion": "fiscal-document-extractors.2026-07.v2",
    "extractorVersion": "aeat.model.036.v2"
  }
}
