{
  "corpusVersion": "fiscal-extractor-corpus.2026-07.v1",
  "fixtureId": "m111-professionals-only-002-native",
  "semanticCaseId": "m111-professionals-only-002",
  "parentFixtureId": null,
  "documentType": "MODEL_111",
  "formVersion": "AEAT_MODEL_111_PRINTED_LAYOUT_VERSIONED",
  "fiscalYear": 2026,
  "period": "2T",
  "documentKind": "DRAFT",
  "filingStatus": "DRAFT",
  "temporalScope": "SPECIFIC_PERIOD",
  "lifecycleLabels": [
    "NOT_CURRENT_CENSUS_STATUS"
  ],
  "stateCoverage": "PERIOD_ONLY",
  "visualVariant": "NATIVE_PDF",
  "expectedEnvelope": {
    "isComplete": false
  },
  "expectedFields": [
    {
      "factType": "WITHHOLDING.ECONOMIC_ACTIVITY_RECIPIENTS",
      "value": {
        "paid": true,
        "categoryRequiresAnnualDetail": true
      },
      "normalizedValue": {
        "paid": true,
        "categoryRequiresAnnualDetail": true
      },
      "page": 1,
      "sourceLabel": "Rendimientos de actividades económicas · N.º perceptores"
    }
  ],
  "expectedQuestionMappings": [],
  "mustNotInfer": [
    {
      "code": "CURRENT_CENSUS_STATUS",
      "reason": "Una declaración concreta no acredita por sí sola la situación censal actual."
    },
    {
      "code": "FUTURE_OBLIGATION",
      "reason": "Una declaración de un período no acredita una obligación futura."
    },
    {
      "code": "VERIFIED_FILING",
      "reason": "El impreso sintético no acredita presentación ante la AEAT."
    },
    {
      "code": "OFFICIAL_DOCUMENT_VALIDITY",
      "reason": "El documento sintético carece de validez oficial."
    },
    {
      "code": "EMPLOYEES_FROM_MODEL_111",
      "reason": "El 111 no permite afirmar empleados por ausencia o por una fila distinta."
    },
    {
      "code": "ABSENCE_OUTSIDE_CAPTURE",
      "reason": "Una captura parcial no permite inferir datos ausentes fuera de ella."
    }
  ],
  "allowAdditionalFactTypes": [],
  "source": {
    "kind": "SYNTHETIC_OFFICIAL_FORM",
    "authorizationRecorded": true,
    "sha256": "2a34fbe7c2f37f12cf9af0f792cd8038c9ab2e71c8eba551a03542c0cecd4e41",
    "officialReference": {
      "url": "https://sede.agenciatributaria.gob.es/Sede/procedimientoini/GH01.shtml",
      "capturedOn": "2026-07-15",
      "sha256": null
    },
    "anonymizationAudit": {
      "textLayerChecked": true,
      "acroFormChecked": true,
      "metadataChecked": true,
      "annotationsChecked": true,
      "hiddenPagesChecked": true,
      "qrAndBarcodeChecked": true,
      "embeddedFilesChecked": true,
      "originalFileNameStored": false
    }
  },
  "asset": {
    "pdfPath": "pdf/m111-professionals-only-002-native.pdf",
    "extractedTextPath": "text/m111-professionals-only-002-native.txt"
  },
  "extractor": {
    "contractVersion": "1.0.0",
    "catalogVersion": "fiscal-document-extractors.2026-07.v2",
    "extractorVersion": "aeat.model.111.v2"
  }
}
