{
  "corpusVersion": "fiscal-extractor-corpus.2026-07.v1",
  "fixtureId": "aeat-obligations-active-inactive-003-screenshot",
  "semanticCaseId": "aeat-obligations-active-inactive-003",
  "parentFixtureId": null,
  "documentType": "AEAT_OBLIGATIONS_VIEW",
  "formVersion": "SYNTHETIC_AEAT_INSPIRED_OBLIGATIONS_VIEW_V1",
  "fiscalYear": 2026,
  "period": null,
  "documentKind": "CURRENT_AEAT_VIEW",
  "filingStatus": "NOT_VERIFIED",
  "temporalScope": "CURRENT_AS_OF_DATE",
  "lifecycleLabels": [
    "CURRENT_EVIDENCE"
  ],
  "stateCoverage": "PARTIAL_CURRENT_STATE",
  "visualVariant": "SCREENSHOT",
  "expectedEnvelope": {
    "isComplete": false
  },
  "expectedFields": [
    {
      "factType": "CENSUS.PERIODIC_OBLIGATIONS",
      "value": [
        "130"
      ],
      "normalizedValue": [
        "130"
      ],
      "page": 1,
      "sourceLabel": "Obligaciones tributarias en alta"
    }
  ],
  "expectedQuestionMappings": [
    {
      "questionId": "N_CENSUS_OBLIGATIONS",
      "proposedAnswer": [
        "130"
      ],
      "canSkipQuestion": false,
      "confirmationRequired": true
    }
  ],
  "mustNotInfer": [
    {
      "code": "OFFICIAL_DOCUMENT_VALIDITY",
      "reason": "La vista funcional sintética no es una captura ni certificado oficial."
    },
    {
      "code": "ABSENCE_OUTSIDE_CAPTURE",
      "reason": "Una captura parcial no permite inferir datos ausentes fuera de ella."
    }
  ],
  "allowAdditionalFactTypes": [],
  "source": {
    "kind": "SYNTHETIC_FUNCTIONAL_VIEW",
    "authorizationRecorded": true,
    "sha256": "e719febf8c37213218a9a793c6195eb6e2945369d4f63e01bca5c189e6b4d32a",
    "officialReference": {
      "url": "https://sede.agenciatributaria.gob.es/Sede/ayuda/consultas-informaticas/otros-servicios-ayuda-tecnica/datos-censales.html",
      "capturedOn": "2026-07-15",
      "sha256": null
    },
    "anonymizationAudit": {
      "textLayerChecked": true,
      "acroFormChecked": true,
      "metadataChecked": true,
      "annotationsChecked": true,
      "hiddenPagesChecked": true,
      "qrAndBarcodeChecked": true,
      "embeddedFilesChecked": true,
      "originalFileNameStored": false
    }
  },
  "asset": {
    "pdfPath": "pdf/aeat-obligations-active-inactive-003-screenshot.pdf",
    "extractedTextPath": "text/aeat-obligations-active-inactive-003-screenshot.txt"
  },
  "extractor": {
    "contractVersion": "1.0.0",
    "catalogVersion": "fiscal-document-extractors.2026-07.v2",
    "extractorVersion": "aeat.aeat_obligations_view.v2"
  }
}
